{
    "comments": [
        "This file includes all important information",
        "to start a jpscore simulation"
    ],
    "version": 0.1,  
    "fps": 10,
    "time_step": 0.01,
    "simulation_time": 100,
    "accessible_areas": [
        {
        "id": 1,
        "vertices": [
            [50, 100],
            [60, 100],
            [60, 104],
            [50, 104]
        ]
    },
        {
        "id": 2,
        "vertices": [
            [60, 101.4],
            [62, 101.4],
            [62, 102.6],
            [60, 102.6]
        ]
    },
        {
        "id": 3,
        "vertices": [
            [62, 100],
            [65, 100],
            [65, 104],
            [62, 104]
        ]
    }
    ],
    "destinations": [
        {
        "id": 2,
        "vertices": [
            [60, 102.6],
            [60, 101.4]
        ]
    },
        {
        "id": 3,
        "vertices": [
            [62, 101.4],
            [62, 102.6]
        ]
    }
    ],
    "velocity_model_parameter_profiles": [
        {
        "id": 1,
        "time_gap":1,
        "tau": 0.5,
        "v0":1.0,
        "radius":0.15
    },
        {
        "id": 2,
        "time_gap":1,
        "tau": 0.5,
        "v0":0.1,
        "radius":0.2      
    }
    ],
    "way_points": [
        {
        "coordinates": [61, 102],
        "distance": 1
    },
        {
        "coordinates": [64.75, 102],
        "distance": 0.25
    }
    ],
    "distribution_polygons": [
        {
        "id": 1,
        "vertices": [
            [50, 100],
            [53, 100],
            [53, 104],
            [50, 104]
        ]
    },
        {
        "id": 2,
        "vertices": [
            [57, 100],
            [60, 100],
            [60, 104],
            [57, 104]
        ]
    }
    ]
}
